{
  "artifact_types": [
    "production canary samples",
    "baseline diff and classification",
    "noise-control and confidence record",
    "investigation or rollback recommendation"
  ],
  "capability_id": "capability:production-canary-monitoring",
  "execution": {
    "candidate_execution_state": "not-executed-phase-7",
    "external": "read-only",
    "host_actions": [
      "approved-local-commands",
      "approved-artifact-write",
      "approved-provider-read"
    ],
    "model_tools": [
      "read"
    ],
    "mutation_scope": "artifact-output",
    "remote_write": false
  },
  "forbidden_actions": [
    "request, reveal, print, persist, hash, or transmit credential or secret values",
    "perform repository, provider, production, telemetry, incident, local-system, deployment, merge, or rollback mutation outside the exact atomic scope and fresh per-action authorization",
    "invent commands, provider receipts, deployment status, production evidence, incident actions, rollback result, approval, or release evidence",
    "combine readiness with action, observation with rollback, coordination with mitigation execution, or learning with unapproved persistence",
    "claim Phase 9 evaluation, Phase 10 approval, or released status"
  ],
  "hard_gates": [
    "Canary monitoring is read-only: immutable baselines cannot be silently updated, and a threshold breach may recommend but never execute promotion, repair, traffic change, or rollback.",
    "Preflight never changes remote state; observation never executes recovery; coordination never performs specialist actions; one remote authorization never cascades."
  ],
  "id": "production-canary-monitoring",
  "inputs": [
    "A deployed application, safely accessible pages, and a trusted initial baseline."
  ],
  "outputs": [
    "production canary samples",
    "baseline diff and classification",
    "noise-control and confidence record",
    "investigation or rollback recommendation"
  ],
  "permission_identity": "artifact-write-local-exec-external-read",
  "policy": {
    "coverage": [
      "immutable-baseline",
      "allowlisted-production",
      "sampling-window",
      "noise-control",
      "diff-classification",
      "no-auto-rollback"
    ],
    "data_governance": true,
    "human_decision": true,
    "observation_action_separation": true,
    "remote_or_system_action": false
  },
  "responsibility": "Continuously sample approved production pages or signals against immutable baselines, control alert noise, and recommend investigation or rollback without production mutation.",
  "schema_version": "2.0",
  "status": "evaluating",
  "statuses": [
    "passed",
    "needs-input",
    "blocked",
    "failed"
  ],
  "version": "0.1.0-v2-candidate"
}
