{
  "artifact_types": [
    "AI adoption and pilot plan",
    "leadership decision material",
    "value and safety measurement contract",
    "ownership, enablement, and stop criteria"
  ],
  "capability_id": "capability:ai-organizational-adoption-and-leadership",
  "execution": {
    "candidate_execution_state": "not-executed-phase-7",
    "external": "none",
    "host_actions": [],
    "model_tools": [
      "read",
      "edit",
      "write"
    ],
    "mutation_scope": "run-output",
    "remote_write": false
  },
  "forbidden_actions": [
    "request, reveal, print, persist, hash, or transmit credential or secret values",
    "perform repository, provider, production, telemetry, incident, local-system, deployment, merge, or rollback mutation outside the exact atomic scope and fresh per-action authorization",
    "invent commands, provider receipts, deployment status, production evidence, incident actions, rollback result, approval, or release evidence",
    "combine readiness with action, observation with rollback, coordination with mitigation execution, or learning with unapproved persistence",
    "claim Phase 9 evaluation, Phase 10 approval, or released status"
  ],
  "hard_gates": [
    "AI adoption cannot pass on enthusiasm or tool availability: it needs a reversible pilot, named sponsor and owners, workflow and labor impacts, measurable value and safety outcomes, governance, and stop criteria.",
    "Preflight never changes remote state; observation never executes recovery; coordination never performs specialist actions; one remote authorization never cascades."
  ],
  "id": "ai-organizational-adoption-and-leadership",
  "inputs": [
    "An AI initiative, organizational constraints, leadership questions, pilot candidates, and value hypotheses."
  ],
  "outputs": [
    "AI adoption and pilot plan",
    "leadership decision material",
    "value and safety measurement contract",
    "ownership, enablement, and stop criteria"
  ],
  "permission_identity": "workspace-write",
  "policy": {
    "coverage": [
      "reversible-pilot",
      "sponsor-owner",
      "workflow-impact",
      "capability-building",
      "value-measures",
      "safety-governance",
      "stop-criteria"
    ],
    "data_governance": true,
    "human_decision": true,
    "observation_action_separation": true,
    "remote_or_system_action": false
  },
  "responsibility": "Create an evidence-bounded AI adoption and leadership plan with sponsors, pilot teams, capability building, measurable value, governance, and human decision gates without activating systems.",
  "schema_version": "2.0",
  "status": "evaluating",
  "statuses": [
    "passed",
    "needs-input",
    "blocked",
    "failed"
  ],
  "version": "0.1.0-v2-candidate"
}
