{
  "artifact_types": [
    "merge readiness result",
    "deployment readiness result",
    "fresh PR and artifact evidence",
    "blocker, authorization, and rollback register"
  ],
  "capability_id": "capability:merge-and-deploy-readiness",
  "execution": {
    "candidate_execution_state": "not-executed-phase-7",
    "external": "read-only",
    "host_actions": [
      "approved-local-commands",
      "approved-provider-read"
    ],
    "model_tools": [
      "read"
    ],
    "mutation_scope": "artifact-output",
    "remote_write": false
  },
  "forbidden_actions": [
    "request, reveal, print, persist, hash, or transmit credential or secret values",
    "perform repository, provider, production, telemetry, incident, local-system, deployment, merge, or rollback mutation outside the exact atomic scope and fresh per-action authorization",
    "invent commands, provider receipts, deployment status, production evidence, incident actions, rollback result, approval, or release evidence",
    "combine readiness with action, observation with rollback, coordination with mitigation execution, or learning with unapproved persistence",
    "claim Phase 9 evaluation, Phase 10 approval, or released status"
  ],
  "hard_gates": [
    "Readiness cannot mutate remote state and must issue separate merge and deploy verdicts; a passing merge gate neither performs nor authorizes deployment.",
    "Preflight never changes remote state; observation never executes recovery; coordination never performs specialist actions; one remote authorization never cascades."
  ],
  "id": "merge-and-deploy-readiness",
  "inputs": [
    "A pull request, target branch, CI state, version state, and deployment configuration."
  ],
  "outputs": [
    "merge readiness result",
    "deployment readiness result",
    "fresh PR and artifact evidence",
    "blocker, authorization, and rollback register"
  ],
  "permission_identity": "local-exec-external-read",
  "policy": {
    "coverage": [
      "fresh-readiness",
      "exact-PR",
      "base-head",
      "checks-reviews",
      "artifact-digest",
      "separate-merge-deploy",
      "no-mutation"
    ],
    "data_governance": false,
    "human_decision": true,
    "observation_action_separation": true,
    "remote_or_system_action": false
  },
  "responsibility": "Perform a fresh read-only gate over branch, pull request, conflicts, CI, reviews, version drift, deployment preview, rollback, and authorization before merge or deploy.",
  "schema_version": "2.0",
  "status": "evaluating",
  "statuses": [
    "passed",
    "needs-input",
    "blocked",
    "failed"
  ],
  "version": "0.1.0-v2-candidate"
}
